stimID,Image,option1,option2,option3,option4,
H7,https://dl.dropbox.com/s/v11auy780vopcm7/H7_cue.png?dl=0,The magician lets a coin appear everywhere around the salt shaker.,The magician changes the salt to water.,The magician wraps the salt shaker in the cloth and makes it disappear.,The salt shaker turns into a bottle.,
H10,https://dl.dropbox.com/s/tx4i2g5bl3x4e0y/H10_cue.png?dl=0,The magician magically repairs split card.,The magician is able to split and put back together a card.,"Without touching it, the magician is able to move the pieces of the cards further and further away from each other.",The magician places his hand over the card multiple times and each time a piece disappears.,
H15,https://dl.dropbox.com/s/3v6df99ahq8adep/H15_cue.png?dl=0,The magician balances a toothpick on a deck of cards.,"The magician pierces the deck of cards with a toothpick, but afterwards there is no hole.",The magician lets a card picked by the volunteer appear in the card box.,"When the magician starts to shake the card box, toothpicks start to fall out of the box and the cards have vanished.",
H16,https://dl.dropbox.com/s/jgo383pmivx7ikr/H16_cue.png?dl=0,The magician pours coke into a glass from an empty can.,The magician is able to remove the dents from the can without touching it.,The magician pours coke into a glass and makes it disappear.,"Although the can seems empty, the magician is able to pour sparkling water.",
H17,https://dl.dropbox.com/s/jgu31a17xpyiq3i/H17_cue.png?dl=0,"The magician uses a guillotine to slice breadsticks, but not the volunteer's finger.",The magician rejoins bread sticks which the volunteer sliced with the guillotine.,"The magician places the bread sticks in the bag, when the volunteer looks into the bag the bread sticks have transformed into a bun.","The volunteer tries to slice breadsticks with the guillotine, but cannot do it.",
H19,https://dl.dropbox.com/s/ynacm362gtiu56w/H19_cue.png?dl=0,"The magician places paper in volunteer's hand and sets it alight, revealing a red sponge ball.",The magician lights matches without touching them.,The magician transforms matches into a lighter.,The magician presses a lit match into volunteer's hand without hurting her.,
H35,https://dl.dropbox.com/s/f8wm6vo4ut2qpzp/H35_cue.png?dl=0,The volunteer signs a card which the magician subsequently pulls from a Ziploc bag.,"While the magician is shuffling the deck of cards, all four aces start to appear in the Ziploc bag.",The magician puts all the cards into the Ziploc bag. After snapping their fingers the cards appear in the box and the bag is empty again.,"The volunteer signs a card that is placed into the Ziploc bag, but then appears in the card box.",
H36,https://dl.dropbox.com/s/ufxvnqmsqyfd7wq/H36_cue.png?dl=0,The nut is placed on the middle of the bold by the volunteer and magically unscrews itself.,"The magician shrinks the bolt, so that the nut does not stay on it any longer.",The magician places the nut in the middle of the bold and it magically screws itself.,The magician bends the bolt by hand.,
H37,https://dl.dropbox.com/s/f237r3kp8ogkm3g/H37_cue.png?dl=0,The magician unscrews his own finger and then shakes it back into place.,"The magician claps his gloved hands, the gloves dissapear leaving his hands bare.",The magician turns his gloves into mittens.,"The magician detaches his thumb, but when he turns his hands, the thumb is reattached.",
K2,https://dl.dropbox.com/s/g70czglmr05ftf2/K2_cue.png?dl=0,Green and golden sweets fall out of the pages of the book.,The sweets shown on the pages disappear.,Gummi bears fall out of the book.,Micky and Mini Mouse from the pages of the book are poured out onto the table as little biscuits.,
K3,https://dl.dropbox.com/s/zf5akozk2wtybsm/K3_cue.png?dl=0,The magician makes ladybirds appear and then disappear again.,The magician changes the shape of the leaf.,The magician takes the leaf and turns it into a box of flowers.,The magician changes the colour of the leaf several times.,
K4,https://dl.dropbox.com/s/oxrdm9w74tvfxib/K4_cue.png?dl=0,The magician solves the rubix cube by spinning it in the air.,The rubix cube levitates.,The rubix cube turns into a ball.,The magician shakes the rubix cube and it becomes all white.,
K10,https://dl.dropbox.com/s/wobet70ogx8oo3m/K10_cue.png?dl=0,The safety pins magically interlock without breaking the seal.,The safety pins magically double in size.,"Although there are two safety pins at the beginning, they are magically melt together.",The magician uses the safety pins to create a little star.,
K16_short,https://dl.dropbox.com/s/ofuus9f8daggu4w/K16_short_cue.png?dl=0,"The volunteer selects and signs a card that is placed in the middle of the deck, but then appears on the top of it.","The magician shuffles the cards and places them in front of him. When he taps the card with the pen, they spread out.","The magician covers the unsorted cards with a silk handkerchief. When the handkerchief is removed, each of the cards is marked.","The magician asks the volunteer to mark the cards using the pen. After he shuffles them, the volunteer's writing has disappeared from all of the cards.",
K18,https://dl.dropbox.com/s/zt2zms48an5tkol/K18_cue.png?dl=0,A pack of cards appears from a single piece of paper.,The magician folds the sheet of paper smaller and smaller until it transforms into a pack of cards.,The magician splays out the cards more and more until they resemble bunting.,The magician turns the sheet of paper which now shows a bouquet of flowers.,
K19_long,https://dl.dropbox.com/s/djz13kiif9k8jrz/K19_long_cue.png?dl=0,The balls magically change their location and become a toy rabbit.,The print on the mug changes from a black Q10 to a red B2.,The red balls are placed under the mug and merge to become a form a larger ball.,"The magician covers the mug and the red balls with a handkerchief. When he removes it, there is a tea pot with a red lid.",
K21_long,https://dl.dropbox.com/s/tc3rf4hn12n95wv/K21_long_cue.png?dl=0,The magician flips the middle card over with a slight gesture and then changes the colour of the back of the card from blue to red.,The magician reduces a full deck of cards to only three cards.,The magician places a card between two other cards and makes it disappear.,The magician transforms three cards into a full deck.,
K24,https://dl.dropbox.com/s/4ww147m1539vjar/K24_cue.png?dl=0,A £10 note is transformed into a £20  note.,The note is folded so small that it disappears.,The magician makes a note out of a flower.,The magician folds the £10 note in a piece of paper and tears it. He reveals that the note is still intact afterwards.,
S9,https://dl.dropbox.com/s/qblyq5gup6ju8eo/S9_cue.png?dl=0,The cards magically change their appearance.,"The magician covers the cards with a silk handkerchief. After the silk is removed, the cards are blank.",The magician shows a card and then pulls the correct card from a shuffled deck.,The cards spread across the table into a circle without being touched.,
S11,https://dl.dropbox.com/s/167fk5bvfstv1au/S11_cue.png?dl=0,The magician pushes a cigarette through a coin and then reveals that there is no hole.,"The coin and the cigarette melt into another, so that the cigarette becomes metal.","The magician pushes a cigarette through a coin, but after he has pushed it through, he reveals that the cigarette is a Â£10 note.","The magician uses the coin to slice the cigarette, but it is still intact afterwards.",
S12,https://dl.dropbox.com/s/yumq0um8tsx20nv/S12_cue.png?dl=0,The magician punches a hole in the card. He then moves the hole from one corner to another before finally revealing that it is actually a black spot on the card.,The magician punches a hole into the card. This hole expands as the magician opens his fist.,"The magician punches circular holes into the card, but after the card is turned, the punched holes have a square shape.","The magician punches a hole into the card, which then becomes a toy ladybird.",
S15,https://dl.dropbox.com/s/1j2b4d1j0qgaux6/S15_cue.png?dl=0,The magician places a ring on the stem of the glass without breaking it.,"The magician places the glass upside down on the ring and covers it with a piece of silk. When he removes it, the ring is placed on the stem.",The magician puts the ring into the glass and starts tossing it around until the ring is around the stem.,The magician removes the glass and puts a ring on the stem before reattaching it.,
S18,https://dl.dropbox.com/s/cqgrxqi2uif01v8/S18_cue.png?dl=0,The magician pulls three boxes containing flowers from a paper bag.,The magician is able to hide his whole arm inside the blue paper bag.,The magician produces a rabbit out of the empty paper bag.,When the magician turns the bag inside-out the bag folds into a paper aeroplane.,
S21,https://dl.dropbox.com/s/dbwgmecbgerp5y2/S21_cue.png?dl=0,The magician detaches the head of a spoon by moving the handle up and down.,The magician detaches the head of a spoon by turning the handle clockwise and counter clockwise.,The magician bents the spoon only sing his pinkie as a force.,"The magician covers the spoon with a handkerchief. When he removes it, the spoon is bent.",
S25,https://dl.dropbox.com/s/1lm8w3hvms9so7h/S25_cue.png?dl=0,The magician makes a silk handkerchief appear inside a bread roll.,The magician makes bread rolls appear in his hands.,"The magician holds a bread roll in his left hand, which then appears in his right hand.",The magician makes a signed coin appear inside a bread roll.,
S27,https://dl.dropbox.com/s/actodxq8yh5tjn8/S27_cue.png?dl=0,"The magician pours water into a cup from the bottle and then pours the water into another cup but when he tips it upside down, no water spills out.","The magician pours water into a cup from the bottle, but when he tips it upside down, no water spills out.","Although the magician pours water into both cups, the water bottle seems to refill itself magically whenever the magician snaps his fingers.","The magician pours water into one cup, but the other cup is magically refilled.",
S30,https://dl.dropbox.com/s/l43gwniz6esnjxq/S30_cue.png?dl=0,The magician pulls string through two sticks which appear to be connected. However he then reveals thw two sticks are not connected at all.,The magician is able to join the two separated parts of the stick.,"Without any movement, the magician lets the strings in the sticks dance in little circles around him.",The magician cuts a piece of string in several places and then magically puts it back together again.,
S31,https://dl.dropbox.com/s/04cmycbugl09brn/S31_cue.png?dl=0,"The magician places chopsticks into an envelope, but is still able to crush the envelope and its contents into a paper ball.",The magician transforms the envelope into a Â£10 note.,"As the magician turns around the envelope, writing appears on it.",The magician folds the envelope multiple times until he reveals that it is a pair of chop sticks.,
Trick4,https://dl.dropbox.com/s/yzn463lphxwqonx/Trick4_cue.png?dl=0,The magician puts the mobile phone inside the balloon with a simple gesture of his hands.,"As the magician blows up the balloon, the phone increases in size.","The magician blows up an orange balloon, then the phone flashes and the balloon turns yellow.","As the balloon deflates, the phones starts moving across the surface without the magician touching it.",
Trick6_short,https://dl.dropbox.com/s/a1ghswi9dh70gac/Trick6_short_cue.png?dl=0,"The magician puts a ball under the cup, which then turns into a larger ball and then becomes an egg.",The magician puts the ball under the cup which then turns into an egg and then becomes a chicklet.,The magician puts the ball under the cup and makes it disappear.,"The magician places a red ball underneath the cup, but when he lifts it up, it is an orange balloon.",
Trick7_short,https://dl.dropbox.com/s/qe2ja9v5tz9wa0i/Trick7_short_cue.png?dl=0,"The magician gets the volunteer to hold a foam ball, which he then transforms into  two balls.",The magician places two foam balls in volunteer's hands. The foam balls then start to jump up and down of their own accord.,"The magician places two foam balls in volunteer's hand and sets them alight, revealing two paper balls.",Two sponge balls turn into a cube.,
Trick20_short,https://dl.dropbox.com/s/4rjms5mif7ko2pd/Trick20_short_cue.png?dl=0,"The magician shows the volunteer metal nut and rope. Although he secures the nut with the rope, it repeatdely escapes.","The magician ties a knot around the volunteer's wrist using the rope. After snapping his finger, the nut is tied in the rope, too.","The volunteer holds the nut in her hands which are then tied with the rope. When the magician removes the rope, the nut is no longer in the volunteer's hand but appears in the magician's pocket.","The magician ties rope around the nut, but is not able to remove it afterwards as it seems that the nut has shrunk.",
Trick28,https://dl.dropbox.com/s/hst3000qsirt1rg/Trick28_cue.png?dl=0,The magician links and unlinks several silver rings while they keep their shape.,"Starting with small rings, the magician merges them so that there are less rings in total, but they are larger in size.","The magician firstly puts the rings around his arms, but after he turns around, the volunteer has them around their arms.",The magician links and unlinks several silver rings while the rings shape their appearance once they get linked.,
Trick32_long,https://dl.dropbox.com/s/c3jyh64p6m6lb2c/Trick32_long_cue.png?dl=0,The magician makes a silver coin disappear and reappear several times before it is transformed into a large coin.,The magician has a coin in each of his hands. They both end up in one hand.,"The magician shows a silver and a copper coin. Every time he puts a coin in his pocket, the coin appears again in his hand.",The magician ask the volunteer for a coin. Then the coin magically bends inside the closed fist of the volunteer.,
Trick37,https://dl.dropbox.com/s/gz9cx76iu0bncq2/Trick37_cue.png?dl=0,An elastic band visually travels from finger to finger.,"The magician has an elastic band on his hand, which then magically ends up around the volunteer's hand.",The magician makes several star shapes using the two elastic bands and then produces a star shaped elastic band.,The magician has two elastic bands and tangles them up. They then become untwisted.,
Trick38,https://dl.dropbox.com/s/kc1b222omttxir0/Trick38_cue.png?dl=0,"The magician closes one fist around a silk handkerchief and makes it disappear. Then, he makes it appear in his other hand.",The magician makes a little bird figure appear under the silk handkerchief.,The magician takes a coin from the volunteer and freezes it in the silk.,"The magician closes his hand around a green silk handerchief, but when he opens his hand, the silk is blue.",
H4_long,https://dl.dropbox.com/s/guw445zc2e246mh/H4_long_cue.png?dl=0,The magician makes the coins disappear from his hands and reappear under one of the cards.,"The magician changes the colour of the cards from red to black. ",The magician lets all the coins disappear.,The magician doubles the number of cards.,
K23,https://dl.dropbox.com/s/xu87y1ypojdcuii/K23_cue.png?dl=0,"The magician pierces the note with the pen, but the note is intact afterwards.","The magician draws glasses on the queen's face, but when he snaps his fingers, it disappears.",The magician turns the note from purple to dark green.,The magician makes the money disappear and then reappear in the volunteer's hand.,
,,,,,,